{
  "schema_version": "revit-article-v1",
  "article": {
    "article_key": "bmw-x3-g01-m40i-water-pump",
    "title": "BMW X3 M40i Water Pump Failure",
    "slug": "bmw-x3-m40i-water-pump-failure",
    "article_type": "problem",
    "summary": "How to diagnose and address water pump failure on the BMW X3 G01 M40i B58 engine.",
    "excerpt": "Water pump seal failure is a leading cause of coolant loss on the X3 M40i."
  },
  "vehicle": {
    "manufacturer": "BMW",
    "model": "X3",
    "generation": "G01",
    "trim": "M40i",
    "start_year": 2018,
    "end_year": 2024,
    "engines": ["B58"]
  },
  "cluster": {
    "cluster_key": "bmw-x3-g01-m40i-cooling",
    "name": "Cooling",
    "pillar_article_key": "bmw-x3-g01-m40i-cooling-guide",
    "parent_cluster_key": null
  },
  "seo": {
    "primary_topic": "BMW X3 M40i water pump failure",
    "secondary_topics": ["B58 water pump leak"],
    "search_intent": "informational",
    "seo_title": "BMW X3 M40i Water Pump Failure Guide",
    "meta_description": "Signs and fixes for BMW X3 M40i water pump failure on the B58 engine.",
    "canonical": "auto",
    "index": true,
    "follow": true
  },
  "content": {
    "intro": "The integrated water pump and thermostat unit on the B58 engine is a common failure point on the X3 M40i.",
    "blocks": [
      {
        "type": "heading",
        "level": 2,
        "text": "Failure Symptoms"
      },
      {
        "type": "paragraph",
        "text": "Coolant residue near the pump housing and recurring coolant loss often appear together on affected vehicles."
      }
    ],
    "faq": []
  },
  "internal_links": [
    {
      "target_article_key": "bmw-x3-g01-m40i-coolant-loss",
      "preferred_anchor": "coolant loss",
      "relationship": "related_problem",
      "required": false
    },
    {
      "target_article_key": "bmw-x3-g01-m40i-cooling-guide",
      "preferred_anchor": "cooling system guide",
      "relationship": "pillar",
      "required": false
    }
  ],
  "related_articles": [
    {
      "article_key": "bmw-x3-g01-m40i-coolant-loss",
      "relationship": "related_problem",
      "priority": 10
    }
  ],
  "sources": [],
  "structured_data": {
    "article": true,
    "breadcrumbs": true,
    "faq": false
  },
  "publishing": {
    "status": "draft",
    "author": null,
    "featured_image_id": null,
    "allow_comments": false
  }
}
